name,value
Ba Đình, Ba Đình
Hoàn Kiếm, Hoàn Kiếm
Tây Hồ, Tây Hồ
Long Biên, Long Biên
Cầu Giấy, Cầu Giấy
Đống Đa, Đống Đa
Hai Bà Trưng, Hai Bà Trưng
Hoàng Mai, Hoàng Mai
Thanh Xuân, Thanh Xuân
Sóc Sơn, Sóc Sơn
Đông Anh, Đông Anh
Gia Lâm, Gia Lâm
Nam Từ Liêm, Nam Từ Liêm
Thanh Trì, Thanh Trì
Bắc Từ Liêm, Bắc Từ Liêm
Mê Linh, Mê Linh
Hà Đông, Hà Đông
Sơn Tây, Sơn Tây
Ba Vì, Ba Vì
Phúc Thọ, Phúc Thọ
Đan Phượng, Đan Phượng
Hoài Đức, Hoài Đức
Quốc Oai, Quốc Oai
Thạch Thất, Thạch Thất
Chương Mỹ, Chương Mỹ
Thanh Oai, Thanh Oai
Thường Tín, Thường Tín
Phú Xuyên, Phú Xuyên
Ứng Hòa, Ứng Hòa
Mỹ Đức, Mỹ Đức
Hà Giang, Hà Giang
Đồng Văn, Đồng Văn
Mèo Vạc, Mèo Vạc
Yên Minh, Yên Minh
Quản Bạ, Quản Bạ
Vị Xuyên, Vị Xuyên
Bắc Mê, Bắc Mê
Hoàng Su Phì, Hoàng Su Phì
Xín Mần, Xín Mần
Bắc Quang, Bắc Quang
Quang Bình, Quang Bình
Cao Bằng, Cao Bằng
Bảo Lâm, Bảo Lâm
Bảo Lạc, Bảo Lạc
Hà Quảng, Hà Quảng
Trùng Khánh, Trùng Khánh
Hạ Lang, Hạ Lang
Quảng Hòa, Quảng Hòa
Hoà An, Hoà An
Nguyên Bình, Nguyên Bình
Thạch An, Thạch An
Bắc Kạn, Bắc Kạn
Pác Nặm, Pác Nặm
Ba Bể, Ba Bể
Ngân Sơn, Ngân Sơn
Bạch Thông, Bạch Thông
Chợ Đồn, Chợ Đồn
Chợ Mới, Chợ Mới
Na Rì, Na Rì
Tuyên Quang, Tuyên Quang
Lâm Bình, Lâm Bình
Na Hang, Na Hang
Chiêm Hóa, Chiêm Hóa
Hàm Yên, Hàm Yên
Yên Sơn, Yên Sơn
Sơn Dương, Sơn Dương
Lào Cai, Lào Cai
Bát Xát, Bát Xát
Mường Khương, Mường Khương
Si Ma Cai, Si Ma Cai
Bắc Hà, Bắc Hà
Bảo Thắng, Bảo Thắng
Bảo Yên, Bảo Yên
Sa Pa, Sa Pa
Văn Bàn, Văn Bàn
Điện Biên Phủ, Điện Biên Phủ
Mường Lay, Mường Lay
Mường Nhé, Mường Nhé
Mường Chà, Mường Chà
Tủa Chùa, Tủa Chùa
Tuần Giáo, Tuần Giáo
Điện Biên, Điện Biên
Điện Biên Đông, Điện Biên Đông
Mường Ảng, Mường Ảng
Nậm Pồ, Nậm Pồ
Lai Châu, Lai Châu
Tam Đường, Tam Đường
Mường Tè, Mường Tè
Sìn Hồ, Sìn Hồ
Phong Thổ, Phong Thổ
Than Uyên, Than Uyên
Tân Uyên, Tân Uyên
Nậm Nhùn, Nậm Nhùn
Sơn La, Sơn La
Quỳnh Nhai, Quỳnh Nhai
Thuận Châu, Thuận Châu
Mường La, Mường La
Bắc Yên, Bắc Yên
Phù Yên, Phù Yên
Mộc Châu, Mộc Châu
Yên Châu, Yên Châu
Mai Sơn, Mai Sơn
Sông Mã, Sông Mã
Sốp Cộp, Sốp Cộp
Vân Hồ, Vân Hồ
Yên Bái, Yên Bái
Nghĩa Lộ, Nghĩa Lộ
Lục Yên, Lục Yên
Văn Yên, Văn Yên
Mù Căng Chải, Mù Căng Chải
Trấn Yên, Trấn Yên
Trạm Tấu, Trạm Tấu
Văn Chấn, Văn Chấn
Yên Bình, Yên Bình
Hòa Bình, Hòa Bình
Đà Bắc, Đà Bắc
Lương Sơn, Lương Sơn
Kim Bôi, Kim Bôi
Cao Phong, Cao Phong
Tân Lạc, Tân Lạc
Mai Châu, Mai Châu
Lạc Sơn, Lạc Sơn
Yên Thủy, Yên Thủy
Lạc Thủy, Lạc Thủy
Thái Nguyên, Thái Nguyên
Sông Công, Sông Công
Định Hóa, Định Hóa
Phú Lương, Phú Lương
Đồng Hỷ, Đồng Hỷ
Võ Nhai, Võ Nhai
Đại Từ, Đại Từ
Phổ Yên, Phổ Yên
Phú Bình, Phú Bình
Lạng Sơn, Lạng Sơn
Tràng Định, Tràng Định
Bình Gia, Bình Gia
Văn Lãng, Văn Lãng
Cao Lộc, Cao Lộc
Văn Quan, Văn Quan
Bắc Sơn, Bắc Sơn
Hữu Lũng, Hữu Lũng
Chi Lăng, Chi Lăng
Lộc Bình, Lộc Bình
Đình Lập, Đình Lập
Hạ Long, Hạ Long
Móng Cái, Móng Cái
Cẩm Phả, Cẩm Phả
Uông Bí, Uông Bí
Bình Liêu, Bình Liêu
Tiên Yên, Tiên Yên
Đầm Hà, Đầm Hà
Hải Hà, Hải Hà
Ba Chẽ, Ba Chẽ
Vân Đồn, Vân Đồn
Đông Triều, Đông Triều
Quảng Yên, Quảng Yên
Cô Tô, Cô Tô
Bắc Giang, Bắc Giang
Yên Thế, Yên Thế
Tân Yên, Tân Yên
Lạng Giang, Lạng Giang
Lục Nam, Lục Nam
Lục Ngạn, Lục Ngạn
Sơn Động, Sơn Động
Yên Dũng, Yên Dũng
Việt Yên, Việt Yên
Hiệp Hòa, Hiệp Hòa
Việt Trì, Việt Trì
Phú Thọ, Phú Thọ
Đoan Hùng, Đoan Hùng
Hạ Hoà, Hạ Hoà
Thanh Ba, Thanh Ba
Phù Ninh, Phù Ninh
Yên Lập, Yên Lập
Cẩm Khê, Cẩm Khê
Tam Nông, Tam Nông
Lâm Thao, Lâm Thao
Thanh Sơn, Thanh Sơn
Thanh Thuỷ, Thanh Thuỷ
Tân Sơn, Tân Sơn
Vĩnh Yên, Vĩnh Yên
Phúc Yên, Phúc Yên
Lập Thạch, Lập Thạch
Tam Dương, Tam Dương
Tam Đảo, Tam Đảo
Bình Xuyên, Bình Xuyên
Yên Lạc, Yên Lạc
Vĩnh Tường, Vĩnh Tường
Sông Lô, Sông Lô
Bắc Ninh, Bắc Ninh
Yên Phong, Yên Phong
Quế Võ, Quế Võ
Tiên Du, Tiên Du
Từ Sơn, Từ Sơn
Thuận Thành, Thuận Thành
Gia Bình, Gia Bình
Lương Tài, Lương Tài
Hải Dương, Hải Dương
Chí Linh, Chí Linh
Nam Sách, Nam Sách
Kinh Môn, Kinh Môn
Kim Thành, Kim Thành
Thanh Hà, Thanh Hà
Cẩm Giàng, Cẩm Giàng
Bình Giang, Bình Giang
Gia Lộc, Gia Lộc
Tứ Kỳ, Tứ Kỳ
Ninh Giang, Ninh Giang
Thanh Miện, Thanh Miện
Hồng Bàng, Hồng Bàng
Ngô Quyền, Ngô Quyền
Lê Chân, Lê Chân
Hải An, Hải An
Kiến An, Kiến An
Đồ Sơn, Đồ Sơn
Dương Kinh, Dương Kinh
Thuỷ Nguyên, Thuỷ Nguyên
An Dương, An Dương
An Lão, An Lão
Kiến Thuỵ, Kiến Thuỵ
Tiên Lãng, Tiên Lãng
Vĩnh Bảo, Vĩnh Bảo
Cát Hải, Cát Hải
Hưng Yên, Hưng Yên
Văn Lâm, Văn Lâm
Văn Giang, Văn Giang
Yên Mỹ, Yên Mỹ
Mỹ Hào, Mỹ Hào
Ân Thi, Ân Thi
Khoái Châu, Khoái Châu
Kim Động, Kim Động
Tiên Lữ, Tiên Lữ
Phù Cừ, Phù Cừ
Thái Bình, Thái Bình
Quỳnh Phụ, Quỳnh Phụ
Hưng Hà, Hưng Hà
Đông Hưng, Đông Hưng
Thái Thụy, Thái Thụy
Tiền Hải, Tiền Hải
Kiến Xương, Kiến Xương
Vũ Thư, Vũ Thư
Phủ Lý, Phủ Lý
Duy Tiên, Duy Tiên
Kim Bảng, Kim Bảng
Thanh Liêm, Thanh Liêm
Bình Lục, Bình Lục
Lý Nhân, Lý Nhân
Nam Định, Nam Định
Vụ Bản, Vụ Bản
Ý Yên, Ý Yên
Nghĩa Hưng, Nghĩa Hưng
Nam Trực, Nam Trực
Trực Ninh, Trực Ninh
Xuân Trường, Xuân Trường
Giao Thủy, Giao Thủy
Hải Hậu, Hải Hậu
Ninh Bình, Ninh Bình
Tam Điệp, Tam Điệp
Nho Quan, Nho Quan
Gia Viễn, Gia Viễn
Hoa Lư, Hoa Lư
Yên Khánh, Yên Khánh
Kim Sơn, Kim Sơn
Yên Mô, Yên Mô
Thanh Hóa, Thanh Hóa
Bỉm Sơn, Bỉm Sơn
Sầm Sơn, Sầm Sơn
Mường Lát, Mường Lát
Quan Hóa, Quan Hóa
Bá Thước, Bá Thước
Quan Sơn, Quan Sơn
Lang Chánh, Lang Chánh
Ngọc Lặc, Ngọc Lặc
Cẩm Thủy, Cẩm Thủy
Thạch Thành, Thạch Thành
Hà Trung, Hà Trung
Vĩnh Lộc, Vĩnh Lộc
Yên Định, Yên Định
Thọ Xuân, Thọ Xuân
Thường Xuân, Thường Xuân
Triệu Sơn, Triệu Sơn
Thiệu Hóa, Thiệu Hóa
Hoằng Hóa, Hoằng Hóa
Hậu Lộc, Hậu Lộc
Nga Sơn, Nga Sơn
Như Xuân, Như Xuân
Như Thanh, Như Thanh
Nông Cống, Nông Cống
Đông Sơn, Đông Sơn
Quảng Xương, Quảng Xương
Nghi Sơn, Nghi Sơn
Vinh, Vinh
Cửa Lò, Cửa Lò
Thái Hoà, Thái Hoà
Quế Phong, Quế Phong
Quỳ Châu, Quỳ Châu
Kỳ Sơn, Kỳ Sơn
Tương Dương, Tương Dương
Nghĩa Đàn, Nghĩa Đàn
Quỳ Hợp, Quỳ Hợp
Quỳnh Lưu, Quỳnh Lưu
Con Cuông, Con Cuông
Tân Kỳ, Tân Kỳ
Anh Sơn, Anh Sơn
Diễn Châu, Diễn Châu
Yên Thành, Yên Thành
Đô Lương, Đô Lương
Thanh Chương, Thanh Chương
Nghi Lộc, Nghi Lộc
Nam Đàn, Nam Đàn
Hưng Nguyên, Hưng Nguyên
Hoàng Mai, Hoàng Mai
Hà Tĩnh, Hà Tĩnh
Hồng Lĩnh, Hồng Lĩnh
Hương Sơn, Hương Sơn
Đức Thọ, Đức Thọ
Vũ Quang, Vũ Quang
Nghi Xuân, Nghi Xuân
Can Lộc, Can Lộc
Hương Khê, Hương Khê
Thạch Hà, Thạch Hà
Cẩm Xuyên, Cẩm Xuyên
Kỳ Anh, Kỳ Anh
Lộc Hà, Lộc Hà
Kỳ Anh, Kỳ Anh
Đồng Hới, Đồng Hới
Minh Hóa, Minh Hóa
Tuyên Hóa, Tuyên Hóa
Quảng Trạch, Quảng Trạch
Bố Trạch, Bố Trạch
Quảng Ninh, Quảng Ninh
Lệ Thủy, Lệ Thủy
Ba Đồn, Ba Đồn
Đông Hà, Đông Hà
Quảng Trị, Quảng Trị
Vĩnh Linh, Vĩnh Linh
Hướng Hóa, Hướng Hóa
Gio Linh, Gio Linh
Đa Krông, Đa Krông
Cam Lộ, Cam Lộ
Triệu Phong, Triệu Phong
Hải Lăng, Hải Lăng
Huế, Huế
Phong Điền, Phong Điền
Quảng Điền, Quảng Điền
Phú Vang, Phú Vang
Hương Thủy, Hương Thủy
Hương Trà, Hương Trà
A Lưới, A Lưới
Phú Lộc, Phú Lộc
Nam Đông, Nam Đông
Liên Chiểu, Liên Chiểu
Thanh Khê, Thanh Khê
Hải Châu, Hải Châu
Sơn Trà, Sơn Trà
Ngũ Hành Sơn, Ngũ Hành Sơn
Cẩm Lệ, Cẩm Lệ
Hòa Vang, Hòa Vang
Tam Kỳ, Tam Kỳ
Hội An, Hội An
Tây Giang, Tây Giang
Đông Giang, Đông Giang
Đại Lộc, Đại Lộc
Điện Bàn, Điện Bàn
Duy Xuyên, Duy Xuyên
Quế Sơn, Quế Sơn
Nam Giang, Nam Giang
Phước Sơn, Phước Sơn
Hiệp Đức, Hiệp Đức
Thăng Bình, Thăng Bình
Tiên Phước, Tiên Phước
Bắc Trà My, Bắc Trà My
Nam Trà My, Nam Trà My
Núi Thành, Núi Thành
Phú Ninh, Phú Ninh
Nông Sơn, Nông Sơn
Quảng Ngãi, Quảng Ngãi
Bình Sơn, Bình Sơn
Trà Bồng, Trà Bồng
Sơn Tịnh, Sơn Tịnh
Tư Nghĩa, Tư Nghĩa
Sơn Hà, Sơn Hà
Sơn Tây, Sơn Tây
Minh Long, Minh Long
Nghĩa Hành, Nghĩa Hành
Mộ Đức, Mộ Đức
Đức Phổ, Đức Phổ
Ba Tơ, Ba Tơ
Quy Nhơn, Quy Nhơn
Hoài Nhơn, Hoài Nhơn
Hoài Ân, Hoài Ân
Phù Mỹ, Phù Mỹ
Vĩnh Thạnh, Vĩnh Thạnh
Tây Sơn, Tây Sơn
Phù Cát, Phù Cát
An Nhơn, An Nhơn
Tuy Phước, Tuy Phước
Vân Canh, Vân Canh
Tuy Hoà, Tuy Hoà
Sông Cầu, Sông Cầu
Đồng Xuân, Đồng Xuân
Tuy An, Tuy An
Sơn Hòa, Sơn Hòa
Sông Hinh, Sông Hinh
Tây Hoà, Tây Hoà
Phú Hoà, Phú Hoà
Đông Hòa, Đông Hòa
Nha Trang, Nha Trang
Cam Ranh, Cam Ranh
Cam Lâm, Cam Lâm
Vạn Ninh, Vạn Ninh
Ninh Hòa, Ninh Hòa
Khánh Vĩnh, Khánh Vĩnh
Diên Khánh, Diên Khánh
Khánh Sơn, Khánh Sơn
Trường Sa, Trường Sa
Phan Rang-Tháp Chàm, Phan Rang-Tháp Chàm
Bác Ái, Bác Ái
Ninh Sơn, Ninh Sơn
Ninh Hải, Ninh Hải
Ninh Phước, Ninh Phước
Thuận Bắc, Thuận Bắc
Thuận Nam, Thuận Nam
Phan Thiết, Phan Thiết
La Gi, La Gi
Tuy Phong, Tuy Phong
Bắc Bình, Bắc Bình
Hàm Thuận Bắc, Hàm Thuận Bắc
Hàm Thuận Nam, Hàm Thuận Nam
Tánh Linh, Tánh Linh
Đức Linh, Đức Linh
Hàm Tân, Hàm Tân
Phú Quí, Phú Quí
Kon Tum, Kon Tum
Đắk Glei, Đắk Glei
Ngọc Hồi, Ngọc Hồi
Đắk Tô, Đắk Tô
Kon Plông, Kon Plông
Kon Rẫy, Kon Rẫy
Đắk Hà, Đắk Hà
Sa Thầy, Sa Thầy
Tu Mơ Rông, Tu Mơ Rông
Ia H' Drai, Ia H' Drai
Pleiku, Pleiku
An Khê, An Khê
Ayun Pa, Ayun Pa
KBang, KBang
Đăk Đoa, Đăk Đoa
Chư Păh, Chư Păh
Ia Grai, Ia Grai
Mang Yang, Mang Yang
Kông Chro, Kông Chro
Đức Cơ, Đức Cơ
Chư Prông, Chư Prông
Chư Sê, Chư Sê
Đăk Pơ, Đăk Pơ
Ia Pa, Ia Pa
Krông Pa, Krông Pa
Phú Thiện, Phú Thiện
Chư Pưh, Chư Pưh
Buôn Ma Thuột, Buôn Ma Thuột
Buôn Hồ, Buôn Hồ
Ea H'leo, Ea H'leo
Ea Súp, Ea Súp
Buôn Đôn, Buôn Đôn
Cư M'gar, Cư M'gar
Krông Búk, Krông Búk
Krông Năng, Krông Năng
Ea Kar, Ea Kar
M'Đrắk, M'Đrắk
Krông Bông, Krông Bông
Krông Pắc, Krông Pắc
Krông A Na, Krông A Na
Lắk, Lắk
Cư Kuin, Cư Kuin
Gia Nghĩa, Gia Nghĩa
Đăk Glong, Đăk Glong
Cư Jút, Cư Jút
Đắk Mil, Đắk Mil
Krông Nô, Krông Nô
Đắk Song, Đắk Song
Đắk R'Lấp, Đắk R'Lấp
Tuy Đức, Tuy Đức
Đà Lạt, Đà Lạt
Bảo Lộc, Bảo Lộc
Đam Rông, Đam Rông
Lạc Dương, Lạc Dương
Lâm Hà, Lâm Hà
Đơn Dương, Đơn Dương
Đức Trọng, Đức Trọng
Di Linh, Di Linh
Đạ Huoai, Đạ Huoai
Đạ Tẻh, Đạ Tẻh
Cát Tiên, Cát Tiên
Phước Long, Phước Long
Đồng Xoài, Đồng Xoài
Bình Long, Bình Long
Bù Gia Mập, Bù Gia Mập
Lộc Ninh, Lộc Ninh
Bù Đốp, Bù Đốp
Hớn Quản, Hớn Quản
Đồng Phú, Đồng Phú
Bù Đăng, Bù Đăng
Chơn Thành, Chơn Thành
Phú Riềng, Phú Riềng
Tây Ninh, Tây Ninh
Tân Biên, Tân Biên
Tân Châu, Tân Châu
Dương Minh Châu, Dương Minh Châu
Châu Thành, Châu Thành
Hòa Thành, Hòa Thành
Gò Dầu, Gò Dầu
Bến Cầu, Bến Cầu
Trảng Bàng, Trảng Bàng
Thủ Dầu Một, Thủ Dầu Một
Bàu Bàng, Bàu Bàng
Dầu Tiếng, Dầu Tiếng
Bến Cát, Bến Cát
Phú Giáo, Phú Giáo
Tân Uyên, Tân Uyên
Dĩ An, Dĩ An
Thuận An, Thuận An
Bắc Tân Uyên, Bắc Tân Uyên
Biên Hòa, Biên Hòa
Long Khánh, Long Khánh
Tân Phú, Tân Phú
Vĩnh Cửu, Vĩnh Cửu
Định Quán, Định Quán
Trảng Bom, Trảng Bom
Thống Nhất, Thống Nhất
Cẩm Mỹ, Cẩm Mỹ
Long Thành, Long Thành
Xuân Lộc, Xuân Lộc
Nhơn Trạch, Nhơn Trạch
Vũng Tàu, Vũng Tàu
Bà Rịa, Bà Rịa
Châu Đức, Châu Đức
Xuyên Mộc, Xuyên Mộc
Long Điền, Long Điền
Đất Đỏ, Đất Đỏ
Phú Mỹ, Phú Mỹ
1,Quận 1
12,Quận 12
2,Quận 2
Gò Vấp, Gò Vấp
Bình Thạnh, Bình Thạnh
Tân Bình, Tân Bình
Tân Phú, Tân Phú
Phú Nhuận, Phú Nhuận
Thủ Đức, Thủ Đức
3,Quận 3
10,Quận 10
11,Quận 11
4,Quận 4
5,Quận 5
6,Quận 6
8,Quận 8
Bình Tân, Bình Tân
7,Quận 7
Củ Chi, Củ Chi
Hóc Môn, Hóc Môn
Bình Chánh, Bình Chánh
Nhà Bè, Nhà Bè
Cần Giờ, Cần Giờ
Tân An, Tân An
Kiến Tường, Kiến Tường
Tân Hưng, Tân Hưng
Vĩnh Hưng, Vĩnh Hưng
Mộc Hóa, Mộc Hóa
Tân Thạnh, Tân Thạnh
Thạnh Hóa, Thạnh Hóa
Đức Huệ, Đức Huệ
Đức Hòa, Đức Hòa
Bến Lức, Bến Lức
Thủ Thừa, Thủ Thừa
Tân Trụ, Tân Trụ
Cần Đước, Cần Đước
Cần Giuộc, Cần Giuộc
Mỹ Tho, Mỹ Tho
Gò Công, Gò Công
Cai Lậy, Cai Lậy
Tân Phước, Tân Phước
Cái Bè, Cái Bè
Cai Lậy, Cai Lậy
Chợ Gạo, Chợ Gạo
Gò Công Tây, Gò Công Tây
Gò Công Đông, Gò Công Đông
Tân Phú Đông, Tân Phú Đông
Bến Tre, Bến Tre
Chợ Lách, Chợ Lách
Mỏ Cày Nam, Mỏ Cày Nam
Giồng Trôm, Giồng Trôm
Bình Đại, Bình Đại
Ba Tri, Ba Tri
Thạnh Phú, Thạnh Phú
Mỏ Cày Bắc, Mỏ Cày Bắc
Trà Vinh, Trà Vinh
Càng Long, Càng Long
Cầu Kè, Cầu Kè
Tiểu Cần, Tiểu Cần
Cầu Ngang, Cầu Ngang
Trà Cú, Trà Cú
Duyên Hải, Duyên Hải
Duyên Hải, Duyên Hải
Vĩnh Long, Vĩnh Long
Long Hồ, Long Hồ
Mang Thít, Mang Thít
Vũng Liêm, Vũng Liêm
Tam Bình, Tam Bình
Bình Minh, Bình Minh
Trà Ôn, Trà Ôn
Bình Tân, Bình Tân
Cao Lãnh, Cao Lãnh
Sa Đéc, Sa Đéc
Hồng Ngự, Hồng Ngự
Tân Hồng, Tân Hồng
Hồng Ngự, Hồng Ngự
Tháp Mười, Tháp Mười
Cao Lãnh, Cao Lãnh
Thanh Bình, Thanh Bình
Lấp Vò, Lấp Vò
Lai Vung, Lai Vung
Long Xuyên, Long Xuyên
Châu Đốc, Châu Đốc
An Phú, An Phú
Tân Châu, Tân Châu
Phú Tân, Phú Tân
Châu Phú, Châu Phú
Tịnh Biên, Tịnh Biên
Tri Tôn, Tri Tôn
Thoại Sơn, Thoại Sơn
Rạch Giá, Rạch Giá
Hà Tiên, Hà Tiên
Kiên Lương, Kiên Lương
Hòn Đất, Hòn Đất
Tân Hiệp, Tân Hiệp
Giồng Riềng, Giồng Riềng
Gò Quao, Gò Quao
An Biên, An Biên
An Minh, An Minh
Vĩnh Thuận, Vĩnh Thuận
Phú Quốc, Phú Quốc
Kiên Hải, Kiên Hải
U Minh Thượng, U Minh Thượng
Giang Thành, Giang Thành
Ninh Kiều, Ninh Kiều
Ô Môn, Ô Môn
Bình Thuỷ, Bình Thuỷ
Cái Răng, Cái Răng
Thốt Nốt, Thốt Nốt
Cờ Đỏ, Cờ Đỏ
Thới Lai, Thới Lai
Vị Thanh, Vị Thanh
Ngã Bảy, Ngã Bảy
Châu Thành A, Châu Thành A
Phụng Hiệp, Phụng Hiệp
Vị Thuỷ, Vị Thuỷ
Long Mỹ, Long Mỹ
Long Mỹ, Long Mỹ
Sóc Trăng, Sóc Trăng
Kế Sách, Kế Sách
Mỹ Tú, Mỹ Tú
Cù Lao Dung, Cù Lao Dung
Long Phú, Long Phú
Mỹ Xuyên, Mỹ Xuyên
Ngã Năm, Ngã Năm
Thạnh Trị, Thạnh Trị
Vĩnh Châu, Vĩnh Châu
Trần Đề, Trần Đề
Bạc Liêu, Bạc Liêu
Hồng Dân, Hồng Dân
Phước Long, Phước Long
Vĩnh Lợi, Vĩnh Lợi
Giá Rai, Giá Rai
Đông Hải, Đông Hải
Hoà Bình, Hoà Bình
Cà Mau, Cà Mau
U Minh, U Minh
Thới Bình, Thới Bình
Trần Văn Thời, Trần Văn Thời
Cái Nước, Cái Nước
Đầm Dơi, Đầm Dơi
Năm Căn, Năm Căn
Ngọc Hiển, Ngọc Hiển
